{
  "audit": {
    "git": {
      "branch": "codex/ST-REC-A",
      "head_sha": "ebc3276106881e24f31451fb8d3eae93766a7688",
      "is_dirty": true,
      "is_git_repo": true,
      "remotes": [
        "origin"
      ],
      "user": {
        "email": "merged-certification-e2e@example.invalid",
        "name": "Merged Certification E2E"
      }
    },
    "run": {
      "run_id": null,
      "session_id": null,
      "thread_id": null,
      "tool": "agentic-sdlc-cli",
      "version": "0.94.0"
    }
  },
  "contract_ref": {
    "hash": "5252e46354c6be367519f58fb6e35c53086c83c84db8fdb315505b101f962794",
    "id": "CONTRACT-REC-A",
    "path": ".sdlc/contracts/CONTRACT-REC-A.json"
  },
  "created_at": "2026-10-10T04:34:46.903Z",
  "created_by": {
    "email": "merged-certification-e2e@example.invalid",
    "id": "antonioantenore",
    "name": "Merged Certification E2E",
    "source": "cli",
    "type": "human"
  },
  "delivery_profile_ref": {
    "hash": "707ea108f3223d6cb9ca4aded4a8fc3cf306164af8d186ab450051f78cecd2f5",
    "id": "AUT-REC-A",
    "path": ".sdlc/autonomy/deliveries/AUT-REC-A.json"
  },
  "git_head_sha": "ebc3276106881e24f31451fb8d3eae93766a7688",
  "hash_algorithm": "sha256:stable-json:v1",
  "id": "PREFLIGHT-AUT-REC-A",
  "kind": "execution_context_preflight_receipt",
  "receipt_hash": "0fb82d8a0e32dd942f962fd42aeafad70b9f5090f85b70459aac22af9b321fd0",
  "requirement_scopes": [
    {
      "allowed_write_paths": [
        "docs",
        "src"
      ],
      "profile_ref": {
        "hash": "577225e3f9bbbad1a90ea73767eff4ecc6bb737b6d404c00f64a7d962874745f",
        "id": "AUT-REQ-REC-A-R1",
        "path": ".sdlc/autonomy/requirements/AUT-REQ-REC-A-R1.json"
      }
    }
  ],
  "schema_version": "execution-context-preflight-receipt:v1",
  "source_snapshots": [],
  "status": "passed",
  "story_ref": {
    "hash": "1b2325cf65beac20e682aacac42ced3f3783d56f4316326490c502e78ab2a0be",
    "id": "ST-REC-A",
    "path": ".sdlc/stories/ST-REC-A/story.json"
  },
  "workspace_changes": []
}
