{
  "audit": {
    "git": {
      "branch": "codex/ST-MERGE-A",
      "head_sha": "ffbe170d17bc74f81bc44212152ac13909aec989",
      "is_dirty": true,
      "is_git_repo": true,
      "remotes": [
        "origin"
      ],
      "user": {
        "email": "merged-certification-e2e@example.invalid",
        "name": "Merged Certification E2E"
      }
    },
    "run": {
      "run_id": null,
      "session_id": null,
      "thread_id": null,
      "tool": "agentic-sdlc-cli",
      "version": "0.94.0"
    }
  },
  "contract_ref": {
    "hash": "03c46e74ecb2dae5c702482b374a7409e5a64ab3017f6d2479fb6f9195095053",
    "id": "CONTRACT-MERGE-A",
    "path": ".sdlc/contracts/CONTRACT-MERGE-A.json"
  },
  "created_at": "2026-10-10T04:29:48.619Z",
  "created_by": {
    "email": "merged-certification-e2e@example.invalid",
    "id": "antonioantenore",
    "name": "Merged Certification E2E",
    "source": "cli",
    "type": "human"
  },
  "delivery_profile_ref": {
    "hash": "a17363738971f91d71c8e8399688502f53f21ccfca3c4dd1adeac441dd6861f9",
    "id": "AUT-MERGE-A",
    "path": ".sdlc/autonomy/deliveries/AUT-MERGE-A.json"
  },
  "git_head_sha": "ffbe170d17bc74f81bc44212152ac13909aec989",
  "hash_algorithm": "sha256:stable-json:v1",
  "id": "PREFLIGHT-AUT-MERGE-A",
  "kind": "execution_context_preflight_receipt",
  "receipt_hash": "403bfedf379e91731a86a87d60cdf4e62a769aa9af870cc6ecbb87124ebd264a",
  "requirement_scopes": [
    {
      "allowed_write_paths": [
        "docs",
        "src"
      ],
      "profile_ref": {
        "hash": "e8f69c576923bf7c74122ad4a7f0c16ea865bb9df0f4cd1008cc80f5b86db4bc",
        "id": "AUT-REQ-MERGE-A-R1",
        "path": ".sdlc/autonomy/requirements/AUT-REQ-MERGE-A-R1.json"
      }
    }
  ],
  "schema_version": "execution-context-preflight-receipt:v1",
  "source_snapshots": [],
  "status": "passed",
  "story_ref": {
    "hash": "b7413e5849de436fb0fcb9e1d73107203c1c28e932e531deb8a4271b0fcff27e",
    "id": "ST-MERGE-A",
    "path": ".sdlc/stories/ST-MERGE-A/story.json"
  },
  "workspace_changes": []
}
