{
  "audit": {
    "git": {
      "branch": "codex/ST-SUCCESSOR",
      "head_sha": "7291c535a28adae4bfa3067988dfd51ac1ffda67",
      "is_dirty": true,
      "is_git_repo": true,
      "remotes": [
        "origin"
      ],
      "user": {
        "email": "finalization-e2e@example.invalid",
        "name": "Finalization E2E"
      }
    },
    "run": {
      "run_id": null,
      "session_id": null,
      "thread_id": null,
      "tool": "agentic-sdlc-cli",
      "version": "0.94.0"
    }
  },
  "contract_ref": {
    "hash": "39482f0eb566f893515546fcaca49238dd424fe259dcb2cc385106685f9db7ae",
    "id": "CONTRACT-SUCCESSOR",
    "path": ".sdlc/contracts/CONTRACT-SUCCESSOR.json"
  },
  "created_at": "2026-10-10T04:32:41.902Z",
  "created_by": {
    "email": "finalization-e2e@example.invalid",
    "id": "antonioantenore",
    "name": "Finalization E2E",
    "source": "cli",
    "type": "human"
  },
  "delivery_profile_ref": {
    "hash": "bd75b646b0e27ff858681010c58e54ec5101f91179022be664ae9159de097a9a",
    "id": "AUT-SUCCESSOR",
    "path": ".sdlc/autonomy/deliveries/AUT-SUCCESSOR.json"
  },
  "git_head_sha": "7291c535a28adae4bfa3067988dfd51ac1ffda67",
  "hash_algorithm": "sha256:stable-json:v1",
  "id": "PREFLIGHT-AUT-SUCCESSOR",
  "kind": "execution_context_preflight_receipt",
  "receipt_hash": "3c8c8a403fd1fda340fc2823d4a44f8cdbf6c58df03f29b7f11dc5c1d4471170",
  "requirement_scopes": [
    {
      "allowed_write_paths": [
        "docs"
      ],
      "profile_ref": {
        "hash": "27d2da846619dc36b4208b609af0be36d08df603527847ee6f9fd0abaa8f5128",
        "id": "AUT-REQ-SUCCESSOR-R1",
        "path": ".sdlc/autonomy/requirements/AUT-REQ-SUCCESSOR-R1.json"
      }
    }
  ],
  "schema_version": "execution-context-preflight-receipt:v1",
  "source_snapshots": [],
  "status": "passed",
  "story_ref": {
    "hash": "988b26a1b5fd76cfbe82aaeee63e76963562ad1a0f765c39776be2f8db840901",
    "id": "ST-SUCCESSOR",
    "path": ".sdlc/stories/ST-SUCCESSOR/story.json"
  },
  "workspace_changes": []
}
