{
  "audit": {
    "git": {
      "branch": "codex/ST-FINAL",
      "head_sha": "c34eca2c1458a65aec285fd1dc699d0d47783794",
      "is_dirty": true,
      "is_git_repo": true,
      "remotes": [
        "origin"
      ],
      "user": {
        "email": "finalization-e2e@example.invalid",
        "name": "Finalization E2E"
      }
    },
    "run": {
      "run_id": null,
      "session_id": null,
      "thread_id": null,
      "tool": "agentic-sdlc-cli",
      "version": "0.94.0"
    }
  },
  "contract_ref": {
    "hash": "d165ad50d3de9d2ec610dd0f72f26ca5489761bff09d108023268734d315fc26",
    "id": "CONTRACT-FINAL",
    "path": ".sdlc/contracts/CONTRACT-FINAL.json"
  },
  "created_at": "2026-10-10T04:29:56.622Z",
  "created_by": {
    "email": "finalization-e2e@example.invalid",
    "id": "antonioantenore",
    "name": "Finalization E2E",
    "source": "cli",
    "type": "human"
  },
  "delivery_profile_ref": {
    "hash": "6240a036e16b4d2daf832c333ec2956359e72f110ddd1623649e126b24f123ff",
    "id": "AUT-FINAL",
    "path": ".sdlc/autonomy/deliveries/AUT-FINAL.json"
  },
  "git_head_sha": "c34eca2c1458a65aec285fd1dc699d0d47783794",
  "hash_algorithm": "sha256:stable-json:v1",
  "id": "PREFLIGHT-AUT-FINAL",
  "kind": "execution_context_preflight_receipt",
  "receipt_hash": "3b8625ea0057c9349bbb67ced1728cd5533de383afcdcb01270040677c0a060d",
  "requirement_scopes": [
    {
      "allowed_write_paths": [
        "docs"
      ],
      "profile_ref": {
        "hash": "e37559e382f33ce65deda857e96229a436f39634879ae1b20bcb9b397f72762c",
        "id": "AUT-REQ-FINAL-R1",
        "path": ".sdlc/autonomy/requirements/AUT-REQ-FINAL-R1.json"
      }
    }
  ],
  "schema_version": "execution-context-preflight-receipt:v1",
  "source_snapshots": [],
  "status": "passed",
  "story_ref": {
    "hash": "77a6349c95025c3f78fe710cadf9bf4d479f9f11f79bdcfebb7d3889a15a500b",
    "id": "ST-FINAL",
    "path": ".sdlc/stories/ST-FINAL/story.json"
  },
  "workspace_changes": []
}
